Sequence,Problem Statement
Prog. 001,"Write a function to find the minimum cost path to reach (m, n) from (0, 0) for the given cost matrix cost[][] and a position (m, n) in cost[][]."
Prog. 002,Write a function to find the similar elements from the given two tuple lists.
Prog. 003,Write a python function to identify non-prime numbers.
Prog. 004,Write a function to find the largest integers from a given list of numbers using heap queue algorithm.
Prog. 005,Write a function to find the number of ways to fill it with 2 x 1 dominoes for the given 3 x n board.
Prog. 006,Write a python function to check whether the two numbers differ at one bit position only or not.
Prog. 007,Write a function to find all words which are at least 4 characters long in a string by using regex.
Prog. 008,Write a function to find squares of individual elements in a list using lambda function.
Prog. 009,Write a python function to find the minimum number of rotations required to get the same string.
Prog. 010,Write a function to get the n smallest items from a dataset.
Prog. 011,Write a python function to remove first and last occurrence of a given character from the string.
Prog. 012,Write a function to sort a given matrix in ascending order according to the sum of its rows.
Prog. 013,Write a function to count the most common words in a dictionary.
Prog. 014,Write a python function to find the volume of a triangular prism.
Prog. 015,Write a function to split a string at lowercase letters.
Prog. 016,Write a function to find sequences of lowercase letters joined with an underscore.
Prog. 017,Write a function to find the perimeter of a square.
Prog. 018,Write a function to remove characters from the first string which are present in the second string.
Prog. 019,Write a function to find whether a given array of integers contains any duplicate element.
Prog. 020,Write a function to check if the given number is woodball or not.
Prog. 021,Write a function to find m number of multiples of n.
Prog. 022,Write a function to find the first duplicate element in a given array of integers.
Prog. 023,Write a python function to find the maximum sum of elements of list in a list of lists.
Prog. 024,Write a function to convert the given binary number to its decimal equivalent.
Prog. 025,Write a python function to find the product of non-repeated elements in a given array.
Prog. 026,Write a function to check if the given tuple list has all k elements.
Prog. 027,Write a python function to remove all digits from a list of strings.
Prog. 028,Write a python function to find binomial co-efficient.
Prog. 029,Write a python function to find the element occurring odd number of times.
Prog. 030,Write a python function to count all the substrings starting and ending with same characters.
Prog. 031,Write a function to find the top k integers that occur most frequently from given lists of sorted and distinct integers using heap queue algorithm.
Prog. 032,Write a python function to find the largest prime factor of a given number.
Prog. 033,Write a python function to convert a decimal number to binary number.
Prog. 034,Write a python function to find the missing number in a sorted array.
Prog. 035,Write a function to find the n-th rectangular number.
Prog. 036,Write a python function to find the nth digit in the proper fraction of two given numbers.
Prog. 037,Write a function to sort a given mixed list of integers and strings.
Prog. 038,Write a function to find the division of first even and odd number of a given list.
Prog. 039,Write a function to check if the letters of a given string can be rearranged so that two characters that are adjacent to each other are different.
Prog. 040,Write a function to find frequency of the elements in a given list of lists using collections module.
Prog. 041,Write a function to filter even numbers using lambda function.
Prog. 042,Write a python function to find the sum of repeated elements in a given array.
Prog. 043,Write a function to find sequences of lowercase letters joined with an underscore using regex.
Prog. 044,Write a function that matches a word at the beginning of a string.
Prog. 045,Write a function to find the gcd of the given array elements.
Prog. 046,Write a python function to determine whether all the numbers are different from each other are not.
Prog. 047,Write a python function to find the last digit when factorial of a divides factorial of b.
Prog. 048,Write a python function to set all odd bits of a given number.
Prog. 049,Write a function to extract every first or specified element from a given two-dimensional list.
Prog. 050,Write a function to find the list with minimum length using lambda function.
Prog. 051,Write a function to print check if the triangle is equilateral or not.
Prog. 052,Write a function to caluclate area of a parallelogram.
Prog. 053,Write a python function to check whether the first and last characters of a given string are equal or not.
Prog. 054,Write a function to sort the given array by using counting sort.
Prog. 055,Write a function to find t-nth term of geometric series.
Prog. 056,Write a python function to check if a given number is one less than twice its reverse.
Prog. 057,Write a python function to find the largest number that can be formed with the given digits.
Prog. 058,Write a python function to check whether the given two integers have opposite sign or not.
Prog. 059,Write a function to find the nth octagonal number.
Prog. 060,Write a function to find the maximum length of the subsequence with difference between adjacent elements for the given array.
Prog. 061,Write a python function to count number of substrings with the sum of digits equal to their length.
Prog. 062,Write a python function to find smallest number in a list.
Prog. 063,Write a function to find the maximum difference between available pairs in the given tuple list.
Prog. 064,Write a function to sort a list of tuples using lambda.
Prog. 065,Write a function of recursion list sum.
Prog. 066,Write a python function to count positive numbers in a list.
Prog. 067,Write a function to find the number of ways to partition a set of bell numbers.
Prog. 068,Write a python function to check whether the given array is monotonic or not.
Prog. 069,Write a function to check whether a list contains the given sublist or not.
Prog. 070,Write a function to find whether all the given tuples have equal length or not.
Prog. 071,Write a function to sort a list of elements using comb sort.
Prog. 072,Write a python function to check whether the given number can be represented as difference of two squares or not.
Prog. 073,Write a function to split the given string with multiple delimiters by using regex.
Prog. 074,Write a function to check whether it follows the sequence given in the patterns array.
Prog. 075,Write a function to find tuples which have all elements divisible by k from the given list of tuples.
Prog. 076,Write a python function to count the number of squares in a rectangle.
Prog. 077,Write a python function to find the difference between sum of even and odd digits.
Prog. 078,Write a python function to find number of integers with odd number of set bits.
Prog. 079,Write a python function to check whether the length of the word is odd or not.
Prog. 080,Write a function to find the nth tetrahedral number.
Prog. 081,Write a function to zip the two given tuples.
Prog. 082,Write a function to find the volume of a sphere.
Prog. 083,Write a python function to find the character made by adding all the characters of the given string.
Prog. 084,Write a function to find the n-th number in newman conway sequence.
Prog. 085,Write a function to find the surface area of a sphere.
Prog. 086,Write a function to find nth centered hexagonal number.
Prog. 087,Write a function to merge three dictionaries into a single expression.
Prog. 088,Write a function to get the frequency of the elements in a list.
Prog. 089,Write a function to find the closest smaller number than n.
Prog. 090,Write a python function to find the length of the longest word.
Prog. 091,Write a function to check if a substring is present in a given list of string values.
Prog. 092,Write a function to check whether the given number is undulating or not.
Prog. 093,Write a function to calculate the value of 'a' to the power 'b'.
Prog. 094,Write a function to extract the index minimum value record from the given tuples.
Prog. 095,Write a python function to find the minimum length of sublist.
Prog. 096,Write a python function to find the number of divisors of a given integer.
Prog. 097,Write a function to find frequency count of list of lists.
Prog. 098,Write a function to multiply all the numbers in a list and divide with the length of the list.
Prog. 099,Write a function to convert the given decimal number to its binary equivalent.
Prog. 100,Write a function to find the next smallest palindrome of a specified number.
Prog. 101,Write a function to find the kth element in the given array.
Prog. 102,Write a function to convert snake case string to camel case string.
Prog. 103,"Write a function to find eulerian number a(n, m)."
Prog. 104,Write a function to sort each sublist of strings in a given list of lists using lambda function.
Prog. 105,Write a python function to count true booleans in the given list.
Prog. 106,Write a function to add the given list to the given tuples.
Prog. 107,Write a python function to count hexadecimal numbers for a given range.
Prog. 108,Write a function to merge multiple sorted inputs into a single sorted iterator using heap queue algorithm.
Prog. 109,Write a python function to find the count of rotations of a binary string with odd value.
Prog. 110,Write a function to extract the ranges that are missing from the given list with the given start range and end range values.
Prog. 111,Write a function to find common elements in given nested lists. * list item * list item * list item * list item
Prog. 112,Write a python function to find the perimeter of a cylinder.
Prog. 113,Write a function to check if a string represents an integer or not.
Prog. 114,Write a function to assign frequency to each tuple in the given tuple list.
Prog. 115,Write a function to check whether all dictionaries in a list are empty or not.
Prog. 116,Write a function to convert a given tuple of positive integers into an integer.
Prog. 117,Write a function to convert all possible convertible elements in the list to float.
Prog. 118,[link text](https:// [link text](https:// [link text](https://)))write a function to convert a string to a list.
Prog. 119,Write a python function to find the element that appears only once in a sorted array.
Prog. 120,Write a function to find the maximum product from the pairs of tuples within a given list.
Prog. 121,Write a function to find the triplet with sum of the given array
Prog. 122,Write a function to find n\u2019th smart number.
Prog. 123,Write a function to sum all amicable numbers from 1 to a specified number.
Prog. 124,Write a function to get the angle of a complex number.
Prog. 125,Write a function to find the maximum difference between the number of 0s and number of 1s in any sub-string of the given binary string.
Prog. 126,Write a python function to find the sum of common divisors of two given numbers.
Prog. 127,Write a function to multiply two integers without using the * operator in python.
Prog. 128,Write a function to shortlist words that are longer than n from a given list of words.
Prog. 129,Write a function to calculate magic square.
Prog. 130,Write a function to find the item with maximum frequency in a given list.
Prog. 131,Write a python function to reverse only the vowels of a given string.
Prog. 132,Write a function to convert tuple to a string.
Prog. 133,Write a function to calculate the sum of the negative numbers of a given list of numbers using lambda function.
Prog. 134,Write a python function to check whether the last element of given array is even or odd after performing an operation p times.
Prog. 135,Write a function to find the nth hexagonal number.
Prog. 136,Write a function to calculate electricity bill.
Prog. 137,Write a function to find the ration of zeroes in an array of integers.
Prog. 138,Write a python function to check whether the given number can be represented as sum of non-zero powers of 2 or not.
Prog. 139,Write a function to find the circumference of a circle.
Prog. 140,Write a function to extract elements that occur singly in the given tuple list.
Prog. 141,Write a function to sort a list of elements using pancake sort.
Prog. 142,Write a function to count the same pair in three given lists.
Prog. 143,Write a function to find number of lists present in the given tuple.
Prog. 144,Write a python function to find the sum of absolute differences in all pairs of the given array.
Prog. 145,Write a python function to find the maximum difference between any two elements in a given array.
Prog. 146,Write a function to find the ascii value of total characters in a string.
Prog. 147,Write a function to find the maximum total path sum in the given triangle.
Prog. 148,Write a function to divide a number into two parts such that the sum of digits is maximum.
Prog. 149,Write a function to find the longest subsequence such that the difference between adjacents is one for the given array.
Prog. 150,Write a python function to find whether the given number is present in the infinite sequence or not.
Prog. 151,Write a python function to check whether the given number is co-prime or not.
Prog. 152,Write a function to sort the given array by using merge sort.
Prog. 153,Write a function to find the vertex of a parabola.
Prog. 154,Write a function to extract every specified element from a given two dimensional list.
Prog. 155,Write a python function to toggle all even bits of a given number.
Prog. 156,Write a function to convert a tuple of string values to a tuple of integer values.
Prog. 157,Write a function to reflect the run-length encoding from a list.
Prog. 158,Write a python function to find k number of operations required to make all elements equal.
Prog. 159,Write a function to print the season for the given month and day.
Prog. 160,Write a function to find x and y that satisfies ax + by = n.
Prog. 161,Write a function to remove all elements from a given list present in another list.
Prog. 162,Write a function to calculate the sum of the positive integers of n+(n-2)+(n-4)... (until n-x =< 0).
Prog. 163,Write a function to calculate the area of a regular polygon.
Prog. 164,Write a python function to check whether the sum of divisors are same or not.
Prog. 165,Write a python function to count characters at same position in a given string (lower and uppercase characters) as in english alphabet.
Prog. 166,Write a python function to count the pairs with xor as an even number.
Prog. 167,Write a python function to find smallest power of 2 greater than or equal to n.
Prog. 168,Write a python function to find the frequency of a number in a given array.
Prog. 169,Write a function to calculate the nth pell number.
Prog. 170,Write a function to find sum of the numbers in a list between the indices of a specified range.
Prog. 171,Write a function to find the perimeter of a pentagon.
Prog. 172,Write a function to find the occurence of characters 'std' in the given string 1. list item 1. list item 1. list item 2. list item 2. list item 2. list item
Prog. 173,Write a function to remove everything except alphanumeric characters from a string.
Prog. 174,Write a function to group a sequence of key-value pairs into a dictionary of lists.
Prog. 175,Write a function to verify validity of a string of parentheses.
Prog. 176,Write a function to find the perimeter of a triangle.
Prog. 177,Write a python function to find two distinct numbers such that their lcm lies within the given range.
Prog. 178,Write a function to search some literals strings in a string.
Prog. 179,Write a function to find if the given number is a keith number or not.
Prog. 180,Write a function to calculate distance between two points using latitude and longitude.
Prog. 181,Write a function to find the longest common prefix in the given set of strings.
Prog. 182,"Write a function to find uppercase, lowercase, special character and numeric values using regex."
Prog. 183,Write a function to count all the distinct pairs having a difference of k in any array.
Prog. 184,Write a function to find all the values in a list that are greater than a specified number.
Prog. 185,Write a function to find the focus of a parabola.
Prog. 186,Write a function to search some literals strings in a string by using regex.
Prog. 187,Write a function to find the longest common subsequence for the given two sequences.
Prog. 188,Write a python function to check whether the given number can be represented by product of two squares or not.
Prog. 189,Write a python function to find the first missing positive number.
Prog. 190,Write a python function to count the number of integral co-ordinates that lie inside a square.
Prog. 191,Write a function to check whether the given month name contains 30 days or not.
Prog. 192,Write a python function to check whether a string has atleast one letter and one number.
Prog. 193,Write a function to remove the duplicates from the given tuple.
Prog. 194,Write a python function to convert octal number to decimal number.
Prog. 195,Write a python function to find the first position of an element in a sorted array.
Prog. 196,Write a function to remove all the tuples with length k.
Prog. 197,Write a function to perform the exponentiation of the given two tuples.
Prog. 198,Write a function to find the largest triangle that can be inscribed in an ellipse.
Prog. 199,Write a python function to find highest power of 2 less than or equal to given number.
Prog. 200,Write a function to find all index positions of the maximum values in a given list.
Prog. 201,Write a python function to check whether the elements in a list are same or not.
Prog. 202,Write a function to remove even characters in a string.
Prog. 203,Write a python function to find the hamming distance between given two integers.
Prog. 204,Write a python function to count the occurrence of a given character in a string.
Prog. 205,Write a function to find the inversions of tuple elements in the given tuple list.
Prog. 206,Write a function to perform the adjacent element concatenation in the given tuples.
Prog. 207,Write a function to count the longest repeating subsequences such that the two subsequences don\u2019t have same string characters at same positions.
Prog. 208,Write a function to check the given decimal with a precision of 2 by using regex.
Prog. 209,Write a function to delete the smallest element from the given heap and then insert a new item.
Prog. 210,"Write a function to check that the given string contains only a certain set of characters(in this case a-z, a-z and 0-9) by using regex."
Prog. 211,Write a python function to count numbers whose oth and nth bits are set.
Prog. 212,Write a python function to find the sum of fourth power of n natural numbers.
Prog. 213,Write a function to perform the concatenation of two string tuples.
Prog. 214,Write a function to convert radians to degrees.
Prog. 215,Write a function to decode a run-length encoded given list.
Prog. 216,Write a function to check if a nested list is a subset of another nested list.
Prog. 217,Write a python function to find the first repeated character in a given string.
Prog. 218,Write a python function to find the minimum operations required to make two numbers equal.
Prog. 219,Write a function to extract maximum and minimum k elements in the given tuple.
Prog. 220,"Write a function to replace maximum n occurrences of spaces, commas, or dots with a colon."
Prog. 221,Write a python function to find the first even number in a given list of numbers.
Prog. 222,Write a function to check if all the elements in tuple have same data type or not.
Prog. 223,Write a function to check for majority element in the given sorted array.
Prog. 224,Write a python function to count set bits of a given number.
Prog. 225,Write a python function to find the minimum element in a sorted and rotated array.
Prog. 226,Write a python function to remove the characters which have odd index values of a given string.
Prog. 227,Write a function to find minimum of three numbers.
Prog. 228,Write a python function to check whether all the bits are unset in the given range or not.
Prog. 229,Write a function to re-arrange the elements of the given array so that all negative elements appear before positive ones.
Prog. 230,Write a function to replace blank spaces with any character in a string.
Prog. 231,Write a function to find the maximum sum in the given right triangle of numbers.
Prog. 232,Write a function to get the n largest items from a dataset.
Prog. 233,Write a function to find the lateral surface area of a cylinder.
Prog. 234,Write a function to find the volume of a cube.
Prog. 235,Write a python function to set all even bits of a given number.
Prog. 236,Write a python function to count the maximum number of equilateral triangles that can be formed within a given equilateral triangle.
Prog. 237,Write a function to check the occurrences of records which occur similar times in the given tuples.
Prog. 238,Write a python function to count number of non-empty substrings of a given string.
Prog. 239,Write a function to find the number of possible sequences of length n such that each of the next element is greater than or equal to twice of the previous element but less than or equal to m.
Prog. 240,Write a function to replace the last element of the list with another list.
Prog. 241,Write a function to generate a 3d array having each element as '*'.
Prog. 242,Write a function to count total characters in a string.
Prog. 243,Write a function to sort the given list based on the occurrence of first element of tuples.
Prog. 244,Write a python function to find the next perfect square greater than a given number.
Prog. 245,Write a function to find the maximum sum of bi-tonic sub-sequence for the given array.
Prog. 246,Write a function for computing square roots using the babylonian method.
Prog. 247,Write a function to find the longest palindromic subsequence in the given string.
Prog. 248,Write a function to calculate the harmonic sum of n-1.
Prog. 249,Write a function to find the intersection of two arrays using lambda function.
Prog. 250,Write a python function to count the occcurences of an element in a tuple.
Prog. 251,Write a function to insert an element before each element of a list.
Prog. 252,Write a python function to convert complex numbers to polar coordinates.
Prog. 253,Write a python function to count integers from a given list.
Prog. 254,Write a function to find all words starting with 'a' or 'e' in a given string.
Prog. 255,Write a function to choose specified number of colours from three different colours and generate all the combinations with repetitions.
Prog. 256,Write a python function to count the number of prime numbers less than a given non-negative number.
Prog. 257,Write a function to swap two numbers.
Prog. 258,Write a function to find number of odd elements in the given list using lambda function.
Prog. 259,Write a function to maximize the given two tuples.
Prog. 260,Write a function to find the nth newman\u2013shanks\u2013williams prime number.
Prog. 261,Write a function to perform mathematical division operation across the given tuples.
Prog. 262,Write a function to split a given list into two parts where the length of the first part of the list is given.
Prog. 263,Write a function to merge two dictionaries.
Prog. 264,Write a function to calculate a dog's age in dog's years.
Prog. 265,Write a function to split a list for every nth element.
Prog. 266,Write a function to find the lateral surface area of a cube.
Prog. 267,Write a python function to find the sum of squares of first n odd natural numbers.
Prog. 268,Write a function to find the n'th star number.
Prog. 269,Write a function to find the ascii value of a character.
Prog. 270,Write a python function to find the sum of even numbers at even positions.
Prog. 271,Write a python function to find the sum of fifth power of first n even natural numbers.
Prog. 272,Write a function to perfom the rear element extraction from list of tuples records.
Prog. 273,Write a function to substract the contents of one tuple with corresponding index of other tuple.
Prog. 274,Write a python function to find sum of even index binomial coefficients.
Prog. 275,Write a python function to find the position of the last removed element from the given array.
Prog. 276,Write a function to find the volume of a cylinder.
Prog. 277,Write a function to filter a dictionary based on values.
Prog. 278,Write a function to find the element count that occurs before the record in the given tuple.
Prog. 279,Write a function to find the nth decagonal number.
Prog. 280,Write a function to search an element in the given array by using sequential search.
Prog. 281,Write a python function to check if the elements of a given list are unique or not.
Prog. 282,Write a function to substaract two lists using map and lambda function.
Prog. 283,Write a python function to check whether the frequency of each digit is less than or equal to the digit itself.
Prog. 284,Write a function to check whether all items of a list are equal to a given string.
Prog. 285,Write a function that matches a string that has an a followed by two to three 'b'.
Prog. 286,Write a function to find the largest sum of contiguous array in the modified array which is formed by repeating the given array k times.
Prog. 287,Write a python function to find the sum of squares of first n even natural numbers.
Prog. 288,Write a function to count array elements having modular inverse under given prime number p equal to itself.
