Sequence,Problem Statement
Prog. 289,Write a python function to calculate the number of odd days in a given year.
Prog. 290,Write a function to find the list of lists with maximum length.
Prog. 291,Write a function to find out the number of ways of painting the fence such that at most 2 adjacent posts have the same color for the given fence with n posts and k colors.
Prog. 292,Write a python function to find quotient of two numbers.
Prog. 293,Write a function to find the third side of a right angled triangle.
Prog. 294,Write a function to find the maximum value in a given heterogeneous list.
Prog. 295,Write a function to return the sum of all divisors of a number.
Prog. 296,Write a python function to count inversions in an array.
Prog. 297,Write a function to flatten a given nested list structure.
Prog. 298,Write a function to find the nested list elements which are present in another list.
Prog. 299,Write a function to calculate the maximum aggregate from the list of tuples.
Prog. 300,Write a function to find the count of all binary sequences of length 2n such that sum of first n bits is same as sum of last n bits.
Prog. 301,Write a function to find the depth of a dictionary.
Prog. 302,Write a python function to find the most significant bit number which is also a set bit.
Prog. 303,Write a python function to check whether the count of inversion of two types are same or not.
Prog. 304,Write a python function to find element at a given index after number of rotations.
Prog. 305,Write a function to match two words from a list of words starting with letter 'p'.
Prog. 306,"Write a function to find the maximum sum of increasing subsequence from prefix till ith index and also including a given kth element which is after i, i.e., k > i ."
Prog. 307,Write a function to get a colon of a tuple.
Prog. 308,Write a function to find the specified number of largest products from two given lists.
Prog. 309,Write a python function to find the maximum of two numbers.
Prog. 310,Write a function to convert a given string to a tuple.
Prog. 311,Write a python function to set the left most unset bit.
Prog. 312,Write a function to find the volume of a cone.
Prog. 313,Write a python function to print positive numbers in a list.
Prog. 314,Write a function to find out the maximum sum such that no two chosen numbers are adjacent for the given rectangular grid of dimension 2 x n.
Prog. 315,Write a python function to find the first maximum length of even word.
Prog. 316,Write a function to find the index of the last occurrence of a given number in a sorted array.
Prog. 317,Write a function to reflect the modified run-length encoding from a list.
Prog. 318,Write a python function to find the maximum volume of a cuboid with given sum of sides.
Prog. 319,Write a function to find all five characters long word in the given string by using regex.
Prog. 320,Write a function to calculate the difference between the squared sum of first n natural numbers and the sum of squared first n natural numbers.
Prog. 321,Write a function to find the demlo number for the given number.
Prog. 322,Write a function to find all index positions of the minimum values in a given list.
Prog. 323,Write a function to re-arrange the given array in alternating positive and negative items.
Prog. 324,Write a function to extract the sum of alternate chains of tuples.
Prog. 325,Write a python function to find the minimum number of squares whose sum is equal to a given number.
Prog. 326,Write a function to get the word with most number of occurrences in the given strings list.
Prog. 327,Write a function to print check if the triangle is isosceles or not.
Prog. 328,Write a function to rotate a given list by specified number of items to the left direction.
Prog. 329,Write a python function to count negative numbers in a list.
Prog. 330,"Write a function to find all three, four, five characters long words in the given string by using regex."
Prog. 331,Write a python function to count unset bits of a given number.
Prog. 332,Write a function to count character frequency of a given string.
Prog. 333,Write a python function to sort a list according to the second element in sublist.
Prog. 334,Write a python function to check whether the triangle is valid or not if sides are given.
Prog. 335,Write a function to find the sum of arithmetic progression.
Prog. 336,Write a function to check whether the given month name contains 28 days or not.
Prog. 337,"Write a function that matches a word at the end of a string, with optional punctuation."
Prog. 338,Write a python function to count the number of substrings with same first and last characters.
Prog. 339,Write a python function to find the maximum occuring divisor in an interval.
Prog. 340,Write a python function to find the sum of the three lowest positive numbers from a given list of numbers.
Prog. 341,Write a function to convert the given set into ordered tuples.
Prog. 342,Write a function to find the smallest range that includes at-least one element from each of the given arrays.
Prog. 343,Write a function to calculate the number of digits and letters in a string.
Prog. 344,Write a python function to find number of elements with odd factors in a given range.
Prog. 345,Write a function to find the difference between two consecutive numbers in a given list.
Prog. 346,"Write a function to find entringer number e(n, k)."
Prog. 347,Write a python function to count the number of squares in a rectangle.
Prog. 348,Write a function to count sequences of given length having non-negative prefix sums that can be generated by given values.
Prog. 349,Write a python function to check whether the given string is a binary string or not.
Prog. 350,Write a python function to minimize the length of the string by removing occurrence of only one character.
Prog. 351,Write a python function to find the first element occurring k times in a given array.
Prog. 352,Write a python function to check whether all the characters in a given string are unique.
Prog. 353,Write a function to remove a specified column from a given nested list.
Prog. 354,Write a function to find t-nth term of arithemetic progression.
Prog. 355,Write a python function to count the number of rectangles in a circle of radius r.
Prog. 356,Write a function to find the third angle of a triangle using two angles.
Prog. 357,Write a function to find the maximum element of all the given tuple records.
Prog. 358,Write a function to find modulo division of two lists using map and lambda function.
Prog. 359,Write a python function to check whether one root of the quadratic equation is twice of the other or not.
Prog. 360,Write a function to find the n\u2019th carol number.
Prog. 361,Write a function to remove empty lists from a given list of lists.
Prog. 362,Write a python function to find the item with maximum occurrences in a given list.
Prog. 363,Write a function to add the k elements to each element in the tuple.
Prog. 364,Write a function to find the number of flips required to make the given binary string a sequence of alternate characters.
Prog. 365,Write a python function to count the number of digits of a given number.
Prog. 366,Write a python function to find the largest product of the pair of adjacent elements from a given list of integers.
Prog. 367,Write a function to check if a binary tree is balanced or not.
Prog. 368,Write a function to repeat the given tuple n times.
Prog. 369,Write a function to find the lateral surface area of cuboid
Prog. 370,Write a function to sort a tuple by its float element.
Prog. 371,Write a function to find the smallest missing element in a sorted array.
Prog. 372,Write a function to sort a given list of elements in ascending order using heap queue algorithm.
Prog. 373,Write a function to find the volume of a cuboid.
Prog. 374,Write a function to print all permutations of a given string including duplicates.
Prog. 375,Write a function to round the given number to the nearest multiple of a specific number.
Prog. 376,Write a function to remove tuple elements that occur more than once and replace the duplicates with some custom value.
Prog. 377,Write a python function to remove all occurrences of a character in a given string.
Prog. 378,Write a python function to shift last element to first position in the given list.
Prog. 379,Write a function to find the surface area of a cuboid.
Prog. 380,Write a function to generate a two-dimensional array.
Prog. 381,Write a function to sort a list of lists by a given index of the inner list.
Prog. 382,Write a function to find the number of rotations in a circularly sorted array.
Prog. 383,Write a python function to toggle all odd bits of a given number.
Prog. 384,Write a python function to find the frequency of the smallest value in a given array.
Prog. 385,Write a function to find the n'th perrin number using recursion.
Prog. 386,Write a function to find out the minimum no of swaps required for bracket balancing in the given string.
Prog. 387,Write a python function to check whether the hexadecimal number is even or odd.
Prog. 388,Write a python function to find the highest power of 2 that is less than or equal to n.
Prog. 389,Write a function to find the n'th lucas number.
Prog. 390,Write a function to insert a given string at the beginning of all items in a list.
Prog. 391,Write a function to convert more than one list to nested dictionary.
Prog. 392,"Write a function to find the maximum sum possible by using the given equation f(n) = max( (f(n/2) + f(n/3) + f(n/4) + f(n/5)), n)."
Prog. 393,Write a function to find the list with maximum length using lambda function.
Prog. 394,Write a function to check if given tuple is distinct or not.
Prog. 395,Write a python function to find the first non-repeated character in a given string.
Prog. 396,Write a function to check whether the given string starts and ends with the same character or not using regex.
Prog. 397,Write a function to find the median of three specific numbers.
Prog. 398,Write a function to compute the sum of digits of each number of a given list.
Prog. 399,Write a function to perform the mathematical bitwise xor operation across the given tuples.
Prog. 400,Write a function to extract the frequency of unique tuples in the given list order irrespective.
Prog. 401,Write a function to perform index wise addition of tuple elements in the given two nested tuples.
Prog. 402,Write a function to compute the value of ncr%p.
Prog. 403,Write a function to check if a url is valid or not using regex.
Prog. 404,Write a python function to find the minimum of two numbers.
Prog. 405,Write a function to check whether an element exists within a tuple.
Prog. 406,Write a python function to find the parity of a given number.
Prog. 407,Write a function to create the next bigger number by rearranging the digits of a given number.
Prog. 408,Write a function to find k number of pairs which consist of one element from the first array and one element from the second array.
Prog. 409,Write a function to find the minimum product from the pairs of tuples within a given list.
Prog. 410,Write a function to find the minimum value in a given heterogeneous list.
Prog. 411,Write a function to convert the given snake case string to camel case string by using regex.
Prog. 412,Write a python function to remove odd numbers from a given list.
Prog. 413,Write a function to extract the nth element from a given list of tuples.
Prog. 414,Write a python function to check whether the value exists in a sequence or not.
Prog. 415,Write a python function to find a pair with highest product from a given array of integers.
Prog. 416,Write a function to find the maximum sum we can make by dividing number in three parts recursively and summing them up together for the given number.
Prog. 417,Write a function to find common first element in given list of tuple.
Prog. 418,Write a python function to find the sublist having maximum length.
Prog. 419,Write a function to round every number of a given list of numbers and print the total sum multiplied by the length of the list.
Prog. 420,Write a python function to find the cube sum of first n even natural numbers.
Prog. 421,Write a function to concatenate each element of tuple by the delimiter.
Prog. 422,Write a python function to find the average of cubes of first n natural numbers.
Prog. 423,Write a function to solve gold mine problem.
Prog. 424,Write a function to extract only the rear index element of each string in the given tuple.
Prog. 425,Write a function to count the number of sublists containing a particular element.
Prog. 426,Write a function to filter odd numbers using lambda function.
Prog. 427,Write a function to convert a date of yyyy-mm-dd format to dd-mm-yyyy format by using regex.
Prog. 428,Write a function to sort the given array by using shell sort.
Prog. 429,Write a function to extract the elementwise and tuples from the given two tuples.
Prog. 430,Write a function to find the directrix of a parabola.
Prog. 431,Write a function that takes two lists and returns true if they have at least one common element.
Prog. 432,Write a function to find the median of a trapezium.
Prog. 433,Write a function to check whether the entered number is greater than the elements of the given array.
Prog. 434,Write a function that matches a string that has an a followed by one or more b's.
Prog. 435,Write a python function to find the last digit of a given number.
Prog. 436,Write a python function to print negative numbers in a list.
Prog. 437,Write a function to remove odd characters in a string.
Prog. 438,Write a function to count bidirectional tuple pairs.
Prog. 439,Write a function to convert a list of multiple integers into a single integer.
Prog. 440,Write a function to find all adverbs and their positions in a given sentence.
Prog. 441,Write a function to find the surface area of a cube.
Prog. 442,Write a function to find the ration of positive numbers in an array of integers.
Prog. 443,Write a python function to find the largest negative number from the given list.
Prog. 444,Write a function to trim each tuple by k in the given tuple list.
Prog. 445,Write a function to perform index wise multiplication of tuple elements in the given two tuples.
Prog. 446,Write a python function to count the occurence of all elements of list in a tuple.
Prog. 447,Write a function to find cubes of individual elements in a list using lambda function.
Prog. 448,Write a function to calculate the sum of perrin numbers.
Prog. 449,Write a python function to check whether the triangle is valid or not if 3 points are given.
Prog. 450,Write a function to extract specified size of strings from a give list of string values.
Prog. 451,Write a function to remove all whitespaces from the given string using regex.
Prog. 452,Write a function that gives loss amount if the given amount has loss else return none.
Prog. 453,Write a python function to find the sum of even factors of a number.
Prog. 454,Write a function that matches a word containing 'z'.
Prog. 455,Write a function to check whether the given month number contains 31 days or not.
Prog. 456,Write a function to reverse strings in a given list of string values.
Prog. 457,Write a python function to find the sublist having minimum length.
Prog. 458,Write a function to find the area of a rectangle.
Prog. 459,Write a function to remove uppercase substrings from a given string by using regex.
Prog. 460,Write a python function to get the first element of each sublist.
Prog. 461,Write a python function to count the upper case characters in a given string.
Prog. 462,Write a function to find all possible combinations of the elements of a given list.
Prog. 463,Write a function to find the maximum product subarray of the given array.
Prog. 464,Write a function to check if all values are same in a dictionary.
Prog. 465,Write a function to drop empty items from a given dictionary.
Prog. 466,Write a function to find the peak element in the given array.
Prog. 467,Write a python function to convert decimal number to octal number.
Prog. 468,Write a function to find the maximum product formed by multiplying numbers of an increasing subsequence of that array.
Prog. 469,Write a function to find the maximum profit earned from a maximum of k stock transactions
Prog. 470,Write a function to find the pairwise addition of the elements of the given tuples.
Prog. 471,Write a python function to find remainder of array multiplication divided by n.
Prog. 472,Write a python function to check whether the given list contains consecutive numbers or not.
Prog. 473,Write a function to find the tuple intersection of elements in the given tuple list irrespective of their order.
Prog. 474,Write a function to replace characters in a string.
Prog. 475,Write a function to sort counter by value.
Prog. 476,Write a python function to find the sum of the largest and smallest value in a given array.
Prog. 477,Write a python function to convert the given string to lower case.
Prog. 478,Write a function to remove lowercase substrings from a given string.
Prog. 479,Write a python function to find the first digit of a given number.
Prog. 480,Write a python function to find the maximum occurring character in a given string.
Prog. 481,Write a function to determine if there is a subset of the given set with sum equal to the given sum.
Prog. 482,Write a function to find sequences of one upper case letter followed by lower case letters in the given string by using regex.
Prog. 483,Write a python function to find the first natural number whose factorial is divisible by x.
Prog. 484,Write a function to remove the matching tuples from the given two tuples.
Prog. 485,Write a function to find the largest palindromic number in the given array.
Prog. 486,Write a function to compute binomial probability for the given number.
Prog. 487,Write a function to sort a list of tuples in increasing order by the last element in each tuple.
Prog. 488,Write a function to find the area of a pentagon.
Prog. 489,Write a python function to find the frequency of the largest value in a given array.
Prog. 490,Write a function to extract all the pairs which are symmetric in the given tuple list.
Prog. 491,Write a function to find the sum of geometric progression series.
Prog. 492,Write a function to search an element in the given array by using binary search.
Prog. 493,"Write a function to calculate a grid of hexagon coordinates where function returns a list of lists containing 6 tuples of x, y point coordinates."
Prog. 494,Write a function to convert the given binary tuple to integer.
Prog. 495,Write a function to remove lowercase substrings from a given string by using regex.
Prog. 496,Write a function to find the smallest integers from a given list of numbers using heap queue algorithm.
Prog. 497,Write a function to find the surface area of a cone.
Prog. 498,Write a python function to find gcd of two positive integers.
Prog. 499,Write a function to find the diameter of a circle.
Prog. 500,Write a function to concatenate all elements of the given list into a string.
Prog. 501,Write a python function to find common divisor between two numbers in a given pair.
Prog. 502,Write a python function to find remainder of two numbers.
Prog. 503,Write a function to add consecutive numbers of a given list.
Prog. 504,Write a python function to find the cube sum of first n natural numbers.
Prog. 505,Write a function to move all zeroes to the end of the given array.
Prog. 506,"Write a function to calculate the permutation coefficient of given p(n, k)."
Prog. 507,Write a function to remove specific words from a given list.
Prog. 508,Write a function to check if the common elements between two given lists are in the same order or not.
Prog. 509,Write a python function to find the average of odd numbers till a given odd number.
Prog. 510,Write a function to find the number of subsequences having product smaller than k for the given non negative array.
Prog. 511,Write a python function to find minimum sum of factors of a given number.
Prog. 512,Write a function to count the element frequency in the mixed nested tuple.
Prog. 513,Write a function to convert tuple into list by adding the given string after every element.
Prog. 514,Write a function to find the summation of tuple elements in the given tuple list.
Prog. 515,Write a function to check if there is a subset with sum divisible by m.
Prog. 516,Write a function to sort a list of elements using radix sort.
Prog. 517,Write a python function to find the largest postive number from the given list.
Prog. 518,Write a function to find the square root of a perfect number.
Prog. 519,Write a function to calculate volume of a tetrahedron.
Prog. 520,Write a function to find the lcm of the given array elements.
Prog. 521,Write a function to print check if the triangle is scalene or not.
Prog. 522,Write a function to find the longest bitonic subsequence for the given array.
Prog. 523,"Write a function to check whether a given string has a capital letter, a lower case letter, a number and specified length using lambda function."
Prog. 524,Write a function to find the sum of maximum increasing subsequence of the given array.
Prog. 525,Write a python function to check whether two given lines are parallel or not.
Prog. 526,Write a python function to capitalize first and last letters of each word of a given string.
Prog. 527,Write a function to find all pairs in an integer array whose sum is equal to a given number.
Prog. 528,Write a function to find the list of lists with minimum length.
Prog. 529,Write a function to find the nth jacobsthal-lucas number.
Prog. 530,Write a function to find the ration of negative numbers in an array of integers.
Prog. 531,Write a function to find minimum number of coins that make a given value.
Prog. 532,Write a function to check if the two given strings are permutations of each other.
Prog. 533,Write a function to remove particular data type elements from the given tuple.
Prog. 534,Write a function to search a literals string in a string and also find the location within the original string where the pattern occurs.
Prog. 535,Write a function to find the top or bottom surface area of a cylinder.
Prog. 536,Write a function to select the nth items of a list.
Prog. 537,Write a python function to find the first repeated word in a given string.
Prog. 538,Write a python function to convert a given string list to a tuple.
Prog. 539,Write a function to create a list containing the power of said number in bases raised to the corresponding number in the index using map function.
Prog. 540,Write a python function to find the difference between highest and least frequencies in a given array.
Prog. 541,Write a function to find if the given number is abundant or not.
Prog. 542,"Write a function to replace all occurrences of spaces, commas, or dots with a colon in the given string by using regex."
Prog. 543,Write a function to add two numbers and print number of digits of sum.
Prog. 544,Write a function to flatten the tuple list to a string.
Prog. 545,Write a python function to toggle only first and last bits of a given number.
Prog. 546,Write a function to find the last occurrence of a character in a string.
Prog. 547,Write a python function to find the sum of hamming distances of all consecutive numbers from o to n.
Prog. 548,Write a function to find the length of the longest increasing subsequence of the given sequence.
Prog. 549,Write a python function to find the sum of fifth power of first n odd natural numbers.
Prog. 550,Write a python function to find the maximum element in a sorted and rotated array.
Prog. 551,Write a function to extract a specified column from a given nested list.
Prog. 552,Write a python function to check whether a given sequence is linear or not.
Prog. 553,Write a function to convert the given tuple to a floating-point number.
Prog. 554,Write a python function to find odd numbers from a mixed list.
Prog. 555,Write a python function to find the difference between sum of cubes of first n natural numbers and the sum of first n natural numbers.
Prog. 556,Write a python function to count the pairs with xor as an odd number.
Prog. 557,Write a function to toggle characters case in a string.
Prog. 558,Write a python function to find the digit distance between two integers.
Prog. 559,Write a function to find the largest sum of contiguous subarray in the given array.
Prog. 560,Write a function to find the union of elements of the given tuples.
Prog. 561,"Write a function to assign with each element, its pair elements from other similar pairs in the given tuple."
Prog. 562,Write a python function to find the maximum length of sublist.
Prog. 563,Write a function to extract values between quotation marks of a string.
Prog. 564,Write a python function to count unequal element pairs from the given array.
Prog. 565,Write a python function to split a string into characters.
Prog. 566,Write a function to get the sum of a non-negative integer.
Prog. 567,Write a function to check whether a specified list is sorted or not.
Prog. 568,Write a function to create a list of empty dictionaries.
Prog. 569,Write a function to sort each sublist of strings in a given list of lists.
Prog. 570,Write a function to remove words from a given list of strings containing a character or string.
Prog. 571,Write a function to find maximum possible sum of disjoint pairs for the given array of integers and a number k.
Prog. 572,Write a python function to remove two duplicate numbers from a given number of lists.
Prog. 573,Write a python function to calculate the product of the unique numbers of a given list.
Prog. 574,Write a function to find the surface area of a cylinder.
Prog. 575,Write a python function to find nth number in a sequence which is not a multiple of a given number.
Prog. 576,Write a python function to check whether an array is subarray of another or not.
