Sequence,Problem Statement
Prog. 864,Write a function to find palindromes in a given list of strings using lambda function.
Prog. 865,Write a function to print n-times a list using map function.
Prog. 866,Write a function to check whether the given month name contains 31 days or not.
Prog. 867,Write a python function to add a minimum number such that the sum of array becomes even.
Prog. 868,Write a python function to find the length of the last word in a given string.
Prog. 869,"Write a function to remove sublists from a given list of lists, which are outside a given range."
Prog. 870,Write a function to calculate the sum of the positive numbers of a given list of numbers using lambda function.
Prog. 871,Write a python function to check whether the given strings are rotations of each other or not.
Prog. 872,Write a function to check if a nested list is a subset of another nested list.
Prog. 873,Write a function to solve the fibonacci sequence using recursion.
Prog. 874,Write a python function to check if the string is a concatenation of another string.
Prog. 875,Write a function to find the minimum difference in the tuple pairs of given tuples.
Prog. 876,Write a python function to find lcm of two positive integers.
Prog. 877,Write a python function to sort the given string.
Prog. 878,Write a function to check if the given tuple contains only k elements.
Prog. 879,"Write a function that matches a string that has an 'a' followed by anything, ending in 'b' by using regex."
Prog. 880,Write a python function to find number of solutions in quadratic equation.
Prog. 881,Write a function to find the sum of first even and odd number of a given list.
Prog. 882,Write a function to caluclate perimeter of a parallelogram.
Prog. 883,Write a function to find numbers divisible by m and n from a list of numbers using lambda function.
Prog. 884,Write a python function to check whether all the bits are within a given range or not.
Prog. 885,Write a python function to check whether the two given strings are isomorphic to each other or not.
Prog. 886,Write a function to add all the numbers in a list and divide it with the length of the list.
Prog. 887,Write a python function to check whether the given number is odd or not using bitwise operator.
Prog. 888,Write a function to substract the elements of the given nested tuples.
Prog. 889,Write a function to reverse each list in a given list of lists.
Prog. 890,Write a python function to find the index of an extra element present in one sorted array.
Prog. 891,Write a python function to check whether the given two numbers have same number of digits or not.
Prog. 892,Write a function to remove multiple spaces in a string.
Prog. 893,Write a python function to get the last element of each sublist.
Prog. 894,Write a function to convert the given string of float type into tuple.
Prog. 895,Write a function to find the maximum sum of subsequences of given array with no adjacent elements.
Prog. 896,Write a function to sort a list in increasing order by the last element in each tuple from a given list of non-empty tuples.
Prog. 897,Write a python function to check whether the word is present in a given sentence or not.
Prog. 898,"Write a function to extract specified number of elements from a given list, which follow each other continuously."
Prog. 899,Write a python function to check whether an array can be sorted or not by picking only the corner elements.
Prog. 900,Write a function where a string will start with a specific number.
Prog. 901,Write a function to find the smallest multiple of the first n numbers.
Prog. 902,Write a function to combine two dictionaries by adding values for common keys.
Prog. 903,Write a python function to count the total unset bits from 1 to n.
Prog. 904,Write a function to return true if the given number is even else return false.
Prog. 905,Write a python function to find the sum of squares of binomial co-efficients.
Prog. 906,"Write a function to extract year, month and date from a url by using regex."
Prog. 907,Write a function to print the first n lucky numbers.
Prog. 908,Write a function to find the fixed point in the given array.
Prog. 909,Write a function to find the previous palindrome of a specified number.
Prog. 910,Write a function to validate a gregorian date.
Prog. 911,Write a function to compute maximum product of three numbers of a given array of integers using heap queue algorithm.
Prog. 912,"Write a function to find ln, m lobb number."
Prog. 913,Write a function to check for a number at the end of a string.
Prog. 914,Write a python function to check whether the given string is made up of two alternating characters or not.
Prog. 915,Write a function to rearrange positive and negative numbers in a given array using lambda function.
Prog. 916,Write a function to find if there is a triplet in the array whose sum is equal to a given value.
Prog. 917,Write a function to find the sequences of one upper case letter followed by lower case letters.
Prog. 918,Write a function to count coin change.
Prog. 919,Write a python function to multiply all items in the list.
Prog. 920,Write a function to remove all tuples with all none values in the given tuple list.
Prog. 921,Write a function to perform chunking of tuples each of size n.
Prog. 922,Write a function to find a pair with the highest product from a given array of integers.
Prog. 923,Write a function to find the length of the shortest string that has both str1 and str2 as subsequences.
Prog. 924,Write a function to find maximum of two numbers.
Prog. 925,Write a python function to calculate the product of all the numbers of a given tuple.
Prog. 926,Write a function to find n-th rencontres number.
Prog. 927,Write a function to calculate the height of the given binary tree.
Prog. 928,Write a function to convert a date of yyyy-mm-dd format to dd-mm-yyyy format.
Prog. 929,Write a function to count repeated items of a tuple.
Prog. 930,Write a function that matches a string that has an a followed by zero or more b's by using regex.
Prog. 931,Write a function to calculate the sum of series 1\u00b3+2\u00b3+3\u00b3+\u2026.+n\u00b3.
Prog. 932,Write a function to remove duplicate words from a given list of strings.
Prog. 933,Write a function to convert camel case string to snake case string by using regex.
Prog. 934,Write a function to find the nth delannoy number.
Prog. 935,Write a function to calculate the sum of series 1\u00b2+2\u00b2+3\u00b2+\u2026.+n\u00b2.
Prog. 936,Write a function to re-arrange the given tuples based on the given ordered list.
Prog. 937,Write a function to count the most common character in a given string.
Prog. 938,Write a function to find three closest elements from three sorted arrays.
Prog. 939,Write a function to sort a list of dictionaries using lambda function.
Prog. 940,Write a function to sort the given array by using heap sort.
Prog. 941,Write a function to count the elements in a list until an element is a tuple.
Prog. 942,Write a function to check if any list element is present in the given list.
Prog. 943,Write a function to combine two given sorted lists using heapq module.
Prog. 944,Write a function to separate and print the numbers and their position of a given string.
Prog. 945,Write a function to convert the given tuples into set.
Prog. 946,Write a function to find the most common elements and their counts of a specified text.
Prog. 947,Write a python function to find the length of the shortest word.
Prog. 948,Write a function to get an item of a tuple.
Prog. 949,Write a function to sort the given tuple list basis the total digits in tuple.
Prog. 950,Write a function to display sign of the chinese zodiac for given year.
Prog. 951,Write a function to find the maximum of similar indices in two lists of tuples.
Prog. 952,Write a function to compute the value of ncr mod p.
Prog. 953,Write a python function to find the minimun number of subsets with distinct elements.
Prog. 954,Write a function that gives profit amount if the given amount has profit else return none.
Prog. 955,"Write a function to find out, if the given number is abundant."
Prog. 956,Write a function to split the given string at uppercase letters by using regex.
Prog. 957,Write a python function to get the position of rightmost set bit.
Prog. 958,Write a function to convert an integer into a roman numeral.
Prog. 959,Write a python function to find the average of a list.
Prog. 960,Write a function to solve tiling problem.
Prog. 961,Write a function to convert a roman numeral to an integer.
Prog. 962,Write a python function to find the sum of all even natural numbers within the range l and r.
Prog. 963,Write a function to calculate the discriminant value.
Prog. 964,Write a python function to check whether the length of the word is even or not.
Prog. 965,Write a function to convert camel case string to snake case string.
Prog. 966,Write a function to remove an empty tuple from a list of tuples.
Prog. 967,Write a python function to accept the strings which contains all vowels.
Prog. 968,Write a python function to find maximum possible value for the given periodic function.
Prog. 969,Write a function to join the tuples if they have similar initial elements.
Prog. 970,Write a function to find minimum of two numbers.
Prog. 971,"Write a function to find the maximum number of segments of lengths a, b and c that can be formed from n."
Prog. 972,Write a function to concatenate the given two tuples to a nested tuple.
Prog. 973,Write a python function to left rotate the string.
Prog. 974,Write a function to find the minimum total path sum in the given triangle.
,
,
,
,
,
,
,
,
,
,
,
,
,
,
,
,
,
,
,
,
,
,
,
,
,
