Sequence,Problem Statement
Prog. 577,Write a python function to find the last digit in factorial of a given number.
Prog. 578,Write a function to interleave lists of the same length.
Prog. 579,Write a function to find the dissimilar elements in the given two tuples.
Prog. 580,Write a function to extract the even elements in the nested mixed tuple.
Prog. 581,Write a python function to find the surface area of the square pyramid.
Prog. 582,Write a function to check if a dictionary is empty or not.
Prog. 583,Write a function for nth catalan number.
Prog. 584,Write a function to find all adverbs and their positions in a given sentence by using regex.
Prog. 585,Write a function to find the n - expensive price items from a given dataset using heap queue algorithm.
Prog. 586,Write a python function to split the array and add the first part to the end.
Prog. 587,Write a function to convert a list to a tuple.
Prog. 588,Write a python function to find the difference between largest and smallest value in a given array.
Prog. 589,Write a function to find perfect squares between two given numbers.
Prog. 590,Write a function to convert polar coordinates to rectangular coordinates.
Prog. 591,Write a python function to interchange the first and last elements in a list.
Prog. 592,Write a python function to find sum of product of binomial co-efficients.
Prog. 593,Write a function to remove leading zeroes from an ip address.
Prog. 594,Write a function to find the difference of first even and odd number of a given list.
Prog. 595,Write a python function to count minimum number of swaps required to convert one binary string to another.
Prog. 596,Write a function to find the size of the given tuple.
Prog. 597,Write a function to find kth element from the given two sorted arrays.
Prog. 598,Write a function to check whether the given number is armstrong or not.
Prog. 599,Write a function to find sum and average of first n natural numbers.
Prog. 600,Write a python function to check whether the given number is even or not using bitwise operator.
Prog. 601,Write a function to find the longest chain which can be formed from the given set of pairs.
Prog. 602,Write a python function to find the first repeated character in a given string.
Prog. 603,Write a function to get a lucid number smaller than or equal to n.
Prog. 604,Write a function to reverse words in a given string.
Prog. 605,Write a function to check if the given integer is a prime number.
Prog. 606,Write a function to convert degrees to radians.
Prog. 607,Write a function to search a literals string in a string and also find the location within the original string where the pattern occurs by using regex.
Prog. 608,Write a python function to find nth bell number.
Prog. 609,Write a python function to find minimum possible value for the given periodic function.
Prog. 610,Write a python function to remove the k'th element from a given list.
Prog. 611,Write a function to find the maximum of nth column from the given tuple list.
Prog. 612,Write a python function to merge the first and last elements separately in a list of lists.
Prog. 613,Write a function to find the maximum value in record list as tuple attribute in the given tuple list.
Prog. 614,Write a function to find the cumulative sum of all the values that are present in the given tuple list.
Prog. 615,Write a function to find average value of the numbers in a given tuple of tuples.
Prog. 616,Write a function to perfom the modulo of tuple elements in the given two tuples.
Prog. 617,"Write a function to check for the number of jumps required of given length to reach a point of form (d, 0) from origin in a 2d plane."
Prog. 618,Write a function to divide two lists using map and lambda function.
Prog. 619,Write a function to move all the numbers in it to the given string.
Prog. 620,Write a function to find the largest subset where each pair is divisible.
Prog. 621,Write a function to increment the numeric values in the given strings by k.
Prog. 622,Write a function to find the median of two sorted arrays of same size.
Prog. 623,Write a function to find the n-th power of individual elements in a list using lambda function.
Prog. 624,Write a python function to convert the given string to upper case.
Prog. 625,Write a python function to interchange first and last elements in a given list.
Prog. 626,Write a python function to find the largest triangle that can be inscribed in the semicircle.
Prog. 627,Write a python function to find the smallest missing number from the given array.
Prog. 628,Write a function to replace all spaces in the given string with character * list item * list item * list item * list item '%20'.
Prog. 629,Write a python function to find even numbers from a mixed list.
Prog. 630,Write a function to extract all the adjacent coordinates of the given coordinate tuple.
Prog. 631,Write a function to replace whitespaces with an underscore and vice versa in a given string by using regex.
Prog. 632,Write a python function to move all zeroes to the end of the given list.
Prog. 633,Write a python function to find the sum of xor of all pairs of numbers in the given array.
Prog. 634,Write a python function to find the sum of fourth power of first n even natural numbers.
Prog. 635,Write a function to push all values into a heap and then pop off the smallest values one at a time.
Prog. 636,Write a python function to check if roots of a quadratic equation are reciprocal of each other or not.
Prog. 637,Write a function to check whether the given amount has no profit and no loss
Prog. 638,Write a function to calculate wind chill index.
Prog. 639,Write a function to sum the length of the names of a given list of names after removing the names that start with a lowercase letter.
Prog. 640,Write a function to remove the parenthesis area in a string.
Prog. 641,Write a function to find the nth nonagonal number.
Prog. 642,Write a function to remove similar rows from the given tuple matrix.
Prog. 643,"Write a function that matches a word containing 'z', not at the start or end of the word."
Prog. 644,Write a python function to reverse an array upto a given position.
Prog. 645,Write a function to find the product of it\u2019s kth index in the given tuples.
Prog. 646,Write a python function to count number of cubes of size k in a cube of size n.
Prog. 647,Write a function to split a string at uppercase letters.
Prog. 648,Write a function to exchange the position of every n-th value with (n+1)th value and (n+1)th value with n-th value in a given list.
Prog. 649,Write a python function to calculate the sum of the numbers in a list between the indices of a specified range.
Prog. 650,Write a python function to check whether the given two arrays are equal or not.
Prog. 651,Write a function to check if one tuple is a subset of another tuple.
Prog. 652,Write a function to flatten the given tuple matrix into the tuple list with each tuple representing each column.
Prog. 653,Write a function to group a sequence of key-value pairs into a dictionary of lists using collections module.
Prog. 654,Write a function to find the perimeter of a rectangle.
Prog. 655,Write a python function to find the sum of fifth power of n natural numbers.
Prog. 656,Write a python function to find the minimum sum of absolute differences of two arrays.
Prog. 657,Write a python function to find the first digit in factorial of a given number.
Prog. 658,Write a function to find the item with maximum occurrences in a given list.
Prog. 659,Write a python function to print duplicants from a list of integers.
Prog. 660,Write a python function to choose points from two ranges such that no point lies in both the ranges.
Prog. 661,Write a function to find the maximum sum that can be formed which has no three consecutive elements present.
Prog. 662,Write a function to sort a list in a dictionary.
Prog. 663,Write a function to find the largest possible value of k such that k modulo x is y.
Prog. 664,Write a python function to find the average of even numbers till a given even number.
Prog. 665,Write a python function to shift first element to the end of given list.
Prog. 666,Write a function to count occurrence of a character in a string.
Prog. 667,Write a python function to count number of vowels in the string.
Prog. 668,Write a python function to replace multiple occurence of character by single.
Prog. 669,Write a function to check whether the given ip address is valid or not using regex.
Prog. 670,Write a python function to check whether a sequence of numbers has a decreasing trend or not.
Prog. 671,Write a python function to set the right most unset bit.
Prog. 672,Write a function to find maximum of three numbers.
Prog. 673,Write a python function to convert a list of multiple integers into a single integer.
Prog. 674,Write a function to remove duplicate words from a given string using collections module.
Prog. 675,"Write a function to add two integers. however, if the sum is between the given range it will return 20."
Prog. 676,Write a function to remove everything except alphanumeric characters from the given string by using regex.
Prog. 677,Write a function to check if the triangle is valid or not.
Prog. 678,Write a python function to remove spaces from a given string.
Prog. 679,Write a function to access dictionary key\u2019s element by index.
Prog. 680,Write a python function to check whether a sequence of numbers has an increasing trend or not.
Prog. 681,Write a python function to find the smallest prime divisor of a number.
Prog. 682,Write a function to multiply two lists using map and lambda function.
Prog. 683,Write a python function to check whether the given number can be represented by sum of two squares or not.
Prog. 684,Write a python function to count occurences of a character in a repeated string.
Prog. 685,Write a python function to find sum of prime numbers between 1 to n.
Prog. 686,Write a function to find the frequency of each element in the given list.
Prog. 687,Write a function to find the greatest common divisor (gcd) of two integers by using recursion.
Prog. 688,Write a function to get the length of a complex number.
Prog. 689,## write a function to find the minimum number of jumps to reach the end of the array for the given array of integers where each element represents the max number of steps that can be made forward from that element. > indented block > indented block
Prog. 690,Write a function to multiply consecutive numbers of a given list.
Prog. 691,Write a function to group the 1st elements on the basis of 2nd elements in the given tuple list.
Prog. 692,Write a python function to find the last two digits in factorial of a given number.
Prog. 693,Write a function to remove multiple spaces in a string by using regex.
Prog. 694,Write a function to extract unique values from the given dictionary values.
Prog. 695,Write a function to check if each element of the second tuple is greater than its corresponding index in the first tuple.
Prog. 696,Write a function to zip two given lists of lists.
Prog. 697,Write a function to find number of even elements in the given list using lambda function.
Prog. 698,Write a function to sort dictionary items by tuple product of keys for the given dictionary with tuple keys.
Prog. 699,Write a python function to find the minimum number of swaps required to convert one binary string to another.
Prog. 700,Write a function to count the number of elements in a list which are within a specific range.
Prog. 701,Write a function to find the equilibrium index of the given array.
Prog. 702,Write a function to find the minimum number of elements that should be removed such that amax-amin<=k.
Prog. 703,Write a function to check whether the given key is present in the dictionary or not.
Prog. 704,Write a function to calculate the harmonic sum of n-1.
Prog. 705,Write a function to sort a list of lists by length and value.
Prog. 706,Write a function to find whether an array is subset of another array.
Prog. 707,Write a python function to count the total set bits from 1 to n.
Prog. 708,Write a python function to convert a string to a list.
Prog. 709,Write a function to count unique keys for each value present in the tuple.
Prog. 710,Write a function to access the initial and last data of the given tuple record.
Prog. 711,Write a python function to check whether the product of digits of a number at even and odd places is equal or not.
Prog. 712,Write a function to remove duplicates from a list of lists.
Prog. 713,Write a function to check if the given tuple contains all valid values or not.
Prog. 714,Write a python function to count the number of distinct power of prime factor of given number.
Prog. 715,Write a function to convert the given string of integers into a tuple.
Prog. 716,Write a function to find the perimeter of a rombus.
Prog. 717,Write a function to calculate the standard deviation.
Prog. 718,Write a function to create a list taking alternate elements from another given list.
Prog. 719,Write a function that matches a string that has an a followed by zero or more b's.
Prog. 720,Write a function to add a dictionary to the tuple.
Prog. 721,Write a function to find a path with the maximum average over all existing paths for the given square matrix of size n*n.
Prog. 722,Write a function to filter the height and width of students which are stored in a dictionary.
Prog. 723,Write a function to count the same pair in two given lists using map function.
Prog. 724,Write a function to calculate the sum of all digits of the base to the specified power.
Prog. 725,Write a function to extract values between quotation marks of the given string by using regex.
Prog. 726,Write a function to multiply the adjacent elements of the given tuple.
Prog. 727,Write a function to remove all characters except letters and numbers using regex
Prog. 728,Write a function to sum elements in two lists.
Prog. 729,Write a function to add two lists using map and lambda function.
Prog. 730,Write a function to remove consecutive duplicates of a given list.
Prog. 731,Write a function to find the lateral surface area of a cone.
Prog. 732,"Write a function to replace all occurrences of spaces, commas, or dots with a colon."
Prog. 733,Write a function to find the index of the first occurrence of a given number in a sorted array.
Prog. 734,Write a python function to find sum of products of all possible subarrays.
Prog. 735,Write a python function to toggle bits of the number except the first and the last bit.
Prog. 736,Write a function to locate the left insertion point for a specified value in sorted order.
Prog. 737,Write a function to check whether the given string is starting with a vowel or not using regex.
Prog. 738,Write a function to calculate the geometric sum of n-1.
Prog. 739,Write a python function to find the index of smallest triangular number with n digits.
Prog. 740,Write a function to convert the given tuple to a key-value dictionary using adjacent elements.
Prog. 741,Write a python function to check whether all the characters are same or not.
Prog. 742,Write a function to caluclate the area of a tetrahedron.
Prog. 743,Write a function to rotate a given list by specified number of items to the right direction.
Prog. 744,Write a function to check if the given tuple has any none value or not.
Prog. 745,Write a function to find numbers within a given range where every number is divisible by every digit it contains.
Prog. 746,Write a function to find area of a sector.
Prog. 747,Write a function to find the longest common subsequence for the given three string sequence.
Prog. 748,Write a function to put spaces between words starting with capital letters in a given string by using regex.
Prog. 749,Write a function to sort a given list of strings of numbers numerically.
Prog. 750,Write a function to add the given tuple to the given list.
Prog. 751,Write a function to check if the given array represents min heap or not.
Prog. 752,Write a function to find the nth jacobsthal number.
Prog. 753,Write a function to find minimum k records from tuple list.
Prog. 754,Write a function to find common index elements from three lists.
Prog. 755,Write a function to find the second smallest number in a list.
Prog. 756,Write a function that matches a string that has an a followed by zero or one 'b'.
Prog. 757,Write a function to count the pairs of reverse strings in the given string list.
Prog. 758,Write a function to count number of unique lists within a list.
Prog. 759,Write a function to check a decimal with a precision of 2.
Prog. 760,Write a python function to check whether an array contains only one distinct element or not.
Prog. 761,Write a function to caluclate arc length of an angle.
Prog. 762,Write a function to check whether the given month number contains 30 days or not.
Prog. 763,Write a python function to find the minimum difference between any two elements in a given array.
Prog. 764,Write a python function to count numeric values in a given string.
Prog. 765,Write a function to find nth polite number.
Prog. 766,Write a function to iterate over all pairs of consecutive items in a given list.
Prog. 767,Write a python function to count the number of pairs whose sum is equal to \u2018sum\u2019.
Prog. 768,Write a python function to check for odd parity of a given number.
Prog. 769,Write a python function to get the difference between two lists.
Prog. 770,Write a python function to find the sum of fourth power of first n odd natural numbers.
Prog. 771,Write a function to check if the given expression is balanced or not.
Prog. 772,Write a function to remove all the words with k length in the given string.
Prog. 773,Write a function to find the occurrence and position of the substrings within a string.
Prog. 774,Write a function to check if the string is a valid email address or not using regex.
Prog. 775,Write a python function to check whether every odd index contains odd numbers of a given list.
Prog. 776,Write a function to count those characters which have vowels as their neighbors in the given string.
Prog. 777,Write a python function to find the sum of non-repeated elements in a given array.
Prog. 778,Write a function to pack consecutive duplicates of a given list elements into sublists.
Prog. 779,Write a function to count the number of unique lists within a list.
Prog. 780,Write a function to find the combinations of sums with tuples in the given tuple list.
Prog. 781,Write a python function to check whether the count of divisors is even or odd.
Prog. 782,Write a python function to find the sum of all odd length subarrays.
Prog. 783,Write a function to convert rgb color to hsv color.
Prog. 784,Write a function to find the product of first even and odd number of a given list.
Prog. 785,Write a function to convert tuple string to integer tuple.
Prog. 786,Write a function to locate the right insertion point for a specified value in sorted order.
Prog. 787,Write a function that matches a string that has an a followed by three 'b'.
Prog. 788,Write a function to create a new tuple from the given string and list.
Prog. 789,Write a function to calculate the perimeter of a regular polygon.
Prog. 790,Write a python function to check whether every even index contains even numbers of a given list.
Prog. 791,Write a function to remove the nested record from the given tuple.
Prog. 792,Write a python function to count the number of lists in a given number of lists.
Prog. 793,Write a python function to find the last position of an element in a sorted array.
Prog. 794,"Write a function that matches a string that has an 'a' followed by anything, ending in 'b'."
Prog. 795,Write a function to find the n - cheap price items from a given dataset using heap queue algorithm.
Prog. 796,Write function to find the sum of all items in the given dictionary.
Prog. 797,Write a python function to find the sum of all odd natural numbers within the range l and r.
Prog. 798,Write a python function to find the sum of an array.
Prog. 799,Write a python function to left rotate the bits of a given number.
Prog. 800,Write a function to remove all whitespaces from a string.
Prog. 801,Write a python function to count the number of equal numbers from three given integers.
Prog. 802,Write a python function to count the number of rotations required to generate a sorted array.
Prog. 803,Write a python function to check whether the given number is a perfect square or not.
Prog. 804,Write a python function to check whether the product of numbers is even or not.
Prog. 805,Write a function to find the list in a list of lists whose sum of elements is the highest.
Prog. 806,Write a function to find maximum run of uppercase characters in the given string.
Prog. 807,Write a python function to find the first odd number in a given list of numbers.
Prog. 808,Write a function to check if the given tuples contain the k or not.
Prog. 809,Write a function to check if each element of second tuple is smaller than its corresponding index in first tuple.
Prog. 810,Write a function to iterate over elements repeating each as many times as its count.
Prog. 811,Write a function to check if two lists of tuples are identical or not.
Prog. 812,Write a function to abbreviate 'road' as 'rd.' in a given string.
Prog. 813,Write a function to find length of the string.
Prog. 814,Write a function to find the area of a rombus.
Prog. 815,"Write a function to sort the given array without using any sorting algorithm. the given array consists of only 0, 1, and 2."
Prog. 816,Write a function to clear the values of the given tuples.
Prog. 817,Write a function to find numbers divisible by m or n from a list of numbers using lambda function.
Prog. 818,Write a python function to count lower case letters in a given string.
Prog. 819,Write a function to count the frequency of consecutive duplicate elements in a given list of numbers.
Prog. 820,Write a function to check whether the given month number contains 28 days or not.
Prog. 821,Write a function to merge two dictionaries into a single expression.
Prog. 822,Write a function to return true if the password is valid.
Prog. 823,Write a function to check if the given string starts with a substring using regex.
Prog. 824,Write a python function to remove even numbers from a given list.
Prog. 825,Write a python function to access multiple elements of specified index from a given list.
Prog. 826,Write a python function to find the type of triangle from the given sides.
Prog. 827,Write a function to sum a specific column of a list in a given list of lists.
Prog. 828,"Write a function to count alphabets,digits and special charactes in a given string."
Prog. 829,Write a function to find out the second most repeated (or frequent) string in the given sequence.
Prog. 830,Write a function to round up a number to specific digits.
Prog. 831,Write a python function to count equal element pairs from the given array.
Prog. 832,Write a function to extract the maximum numeric value from a string by using regex.
Prog. 833,Write a function to get dictionary keys as a list.
Prog. 834,Write a function to generate a square matrix filled with elements from 1 to n raised to the power of 2 in spiral order.
Prog. 835,Write a python function to find the slope of a line.
Prog. 836,Write a function to find length of the subarray having maximum sum.
Prog. 837,Write a python function to find the cube sum of first n odd natural numbers.
Prog. 838,Write a python function to find minimum number swaps required to make two binary strings equal.
Prog. 839,Write a function to sort the tuples alphabetically by the first item of each tuple.
Prog. 840,Write a python function to check whether the roots of a quadratic equation are numerically equal but opposite in sign or not.
Prog. 841,Write a function to count the number of inversions in the given array.
Prog. 842,Write a function to find the number which occurs for odd number of times in the given array.
Prog. 843,Write a function to find the nth super ugly number from a given prime list of size k using heap queue algorithm.
Prog. 844,Write a python function to find the kth element in an array containing odd elements first and then even elements.
Prog. 845,Write a python function to count the number of digits in factorial of a given number.
Prog. 846,Write a function to find the minimum number of platforms required for a railway/bus station.
Prog. 847,Write a python function to copy a list from a singleton tuple.
Prog. 848,Write a function to find the area of a trapezium.
Prog. 849,Write a python function to find sum of all prime divisors of a given number.
Prog. 850,Write a function to check if a triangle of positive area is possible with the given angles.
Prog. 851,Write a python function to find sum of inverse of divisors.
Prog. 852,Write a python function to remove negative numbers from a list.
Prog. 853,Write a python function to find sum of odd factors of a number.
Prog. 854,Write a function which accepts an arbitrary list and converts it to a heap using heap queue algorithm.
Prog. 855,Write a python function to check for even parity of a given number.
Prog. 856,Write a python function to find minimum adjacent swaps required to sort binary array.
Prog. 857,Write a function to list out the list of given strings individually using map function.
Prog. 858,Write a function to count number of lists in a given list of lists and square the count.
Prog. 859,Write a function to generate all sublists of a given list.
Prog. 860,Write a function to check whether the given string is ending with only alphanumeric characters or not using regex.
Prog. 861,Write a function to find all anagrams of a string in a given list of strings using lambda function.
Prog. 862,Write a function to find the occurrences of n most common words in a given text.
Prog. 863,Write a function to find the length of the longest sub-sequence such that elements in the subsequences are consecutive integers.
